{
  "schemaVersion": 1,
  "id": "record-yesterday",
  "title": "지난 운동 입력",
  "userGoal": "어제 한 푸쉬업 3세트(10회, 8회, 6회)를 기록해 주세요.",
  "fixtureId": "demo-v1",
  "startCaptureId": "records-overview",
  "captureIds": [
    "records-overview",
    "journal-calendar",
    "journal-entry"
  ],
  "allowedActionTypes": [
    "inspect",
    "tap",
    "scroll",
    "input",
    "back",
    "stop"
  ],
  "maxSteps": 20,
  "checks": [
    {
      "id": "entry-discoverable",
      "kind": "observation-only",
      "description": "사용자가 지난 운동 입력 진입점을 화면에서 찾을 수 있는지 점검한다."
    },
    {
      "id": "saved-reps",
      "kind": "app-state",
      "description": "2026-10-11 날짜에 푸쉬업 3세트의 실제 횟수가 10, 8, 6으로 저장됐는지 확인한다."
    }
  ]
}
